{
  "schemaVersion": "my-questionnaire-2d.chain-plan.v1",
  "questionnaireId": "quest-questionnaire-maia2",
  "questionnaireVersion": "1.0.0",
  "chainId": "participant-001-chain-a",
  "defaultFinishBehavior": "resumeCaller",
  "steps": [
    {
      "id": "unity-scenario-01",
      "type": "scenario",
      "package": "org.example.scenario01",
      "activity": "org.example.scenario01.ChainHookActivity",
      "action": "org.questquestionnaire.CHAIN_COMMAND",
      "command": "startScenario",
      "extras": {
        "scenarioId": "unity-scenario-01",
        "trialId": "trial-03"
      }
    },
    {
      "id": "questionnaire-after-scenario-01",
      "type": "questionnaire",
      "package": "org.questquestionnaire.questionnaires2d",
      "activity": "org.questquestionnaire.questionnaires2d.MainActivity",
      "action": "org.questquestionnaire.questionnaires2d.RUN",
      "extras": {
        "mq.sessionId": "participant-001-session-a",
        "mq.experimentId": "quest-questionnaire-study",
        "mq.scenarioId": "unity-scenario-01",
        "mq.trialId": "trial-03",
        "mq.participantId": "P001",
        "mq.participantName": "P001",
        "mq.language": "English",
        "mq.autoCloseDelayMs": 2000
      }
    },
    {
      "id": "unity-scenario-02",
      "type": "scenario",
      "package": "org.example.scenario02",
      "activity": "org.example.scenario02.ChainHookActivity",
      "action": "org.questquestionnaire.CHAIN_COMMAND",
      "command": "startScenario",
      "extras": {
        "scenarioId": "unity-scenario-02"
      }
    }
  ]
}
