{
  "schemaVersion": "my-questionnaire-2d.chain-plan.v1",
  "chainId": "peripersonal-source-hook-candidate-smoke",
  "questionnaireId": "viscereality-maia2",
  "questionnaireVersion": "1.0.0",
  "defaultFinishBehavior": "resumeCaller",
  "steps": [
    {
      "id": "peripersonal-source-hook-candidate",
      "type": "scenario",
      "package": "com.Viscereality.ViscerealityPeriPersonalSpaceRight.SourceHook",
      "activity": "com.unity3d.player.UnityPlayerGameActivity",
      "action": "org.mesmerprism.viscereality.CHAIN_COMMAND",
      "command": "startScenario",
      "extras": {
        "scenarioId": "peripersonal-source-hook-candidate",
        "trialId": "trial-01",
        "mq.sessionId": "peripersonal-source-hook-candidate-session",
        "mq.experimentId": "viscereality-source-hook-validation",
        "mq.scenarioId": "peripersonal-source-hook-candidate",
        "mq.trialId": "trial-01",
        "mq.participantId": "SourceHookP001",
        "mq.participantName": "SourceHookP001",
        "mq.language": "English",
        "mq.sourceAutoContinueDelayMs": 3000
      }
    },
    {
      "id": "questionnaire-after-source-hook-candidate",
      "type": "questionnaire",
      "package": "org.mesmerprism.viscereality.questionnaires2d",
      "activity": ".MainActivity",
      "extras": {
        "mq.sessionId": "peripersonal-source-hook-candidate-session",
        "mq.experimentId": "viscereality-source-hook-validation",
        "mq.scenarioId": "peripersonal-source-hook-candidate",
        "mq.trialId": "trial-01",
        "mq.participantId": "SourceHookP001",
        "mq.participantName": "SourceHookP001",
        "mq.language": "English",
        "mq.autoCloseDelayMs": 0
      }
    }
  ]
}
