{
  "schemaVersion": "my-questionnaire-2d.chain-plan.v1",
  "chainId": "source-hook-stub-then-questionnaire",
  "questionnaireId": "viscereality-maia2",
  "questionnaireVersion": "1.0.0",
  "defaultFinishBehavior": "resumeCaller",
  "steps": [
    {
      "id": "source-hook-stub-scenario",
      "type": "scenario",
      "package": "org.mesmerprism.viscereality.sourcehookstub",
      "activity": "org.mesmerprism.viscereality.sourcehookstub.SourceHookStubActivity",
      "action": "org.mesmerprism.viscereality.CHAIN_COMMAND",
      "command": "startScenario",
      "extras": {
        "scenarioId": "source-hook-stub",
        "mq.autoContinueDelayMs": 1500
      }
    },
    {
      "id": "questionnaire-after-source-hook-stub",
      "type": "questionnaire",
      "package": "org.mesmerprism.viscereality.questionnaires2d",
      "activity": ".MainActivity",
      "extras": {
        "mq.sessionId": "source-hook-stub-session",
        "mq.experimentId": "source-hook-validation",
        "mq.scenarioId": "source-hook-stub",
        "mq.trialId": "trial-01",
        "mq.participantId": "SourceHookP001",
        "mq.participantName": "SourceHookP001",
        "mq.language": "English",
        "mq.autoCloseDelayMs": 0
      }
    }
  ]
}
